[
  {
    "schema_version": "0.2",
    "contact_id": "contact-primary-001",
    "display_name": "Primary Safety Contact",
    "channel": "sms",
    "address": "+15555550100",
    "authorized": true,
    "test_alert_succeeded": true,
    "created_at": "2026-06-22T14:15:00Z",
    "authorization_audit_ref": null,
    "test_alert_audit_ref": null,
    "minimum_disclosure_only": true
  }
]
